,VISIT_AREA_NM,ROAD_NM_ADDR,LOTNO_ADDR,SEARCH_ADDR,data-id
5003,오복 수산 애월점,제주특별자치도 제주시 애월읍 애월북서길 60,제주특별자치도 제주시 애월읍 애월리 2525-1,제주특별자치도 제주시 애월읍 애월리 2525-1,1103261004
5004,공항 자전거,제주특별자치도 제주시 용문로 4,제주특별자치도 제주시 용담이동 1590-3,제주특별자치도 제주시 용담이동 1590-3,no
5005,대왕 해물짬뽕,제주특별자치도 제주시 구좌읍 월정1길 70-6,제주특별자치도 제주시 구좌읍 월정리 554,제주특별자치도 제주시 구좌읍 월정리 554,1911091081
5006,우도 해녀식당,제주특별자치도 제주시 우도면 우도해안길 440,제주특별자치도 제주시 우도면 연평리 2308-3,제주특별자치도 제주시 우도면 연평리 2308-3,37127116
5007,퐁당,제주특별자치도 제주시 우도면 우도해안길 464,제주특별자치도 제주시 우도면 연평리 968,제주특별자치도 제주시 우도면 연평리 968,1695355808
5008,라인업 써프 하도,제주특별자치도 제주시 구좌읍 하도13길 55,제주특별자치도 제주시 구좌읍 하도리 880-12,제주특별자치도 제주시 구좌읍 하도리 880-12,1091468514
5009,바이비,제주특별자치도 제주시 중앙로 88-6,제주특별자치도 제주시 이도일동 1465-1,제주특별자치도 제주시 이도일동 1465-1,1288678760
5010,우리 회수산,제주특별자치도 제주시 동문로2길 10,제주특별자치도 제주시 일도1동 1480-3,제주특별자치도 제주시 일도1동 1480-3,1160607112
5011,해송 주유소,제주특별자치도 제주시 조천읍 일주동로 854,제주특별자치도 제주시 조천읍 조천리 3301,제주특별자치도 제주시 조천읍 조천리 3301,1163553018
5012,탐나 마트 주공 3호점,제주특별자치도 제주시 구남로 16,제주특별자치도 제주시 이도이동 2034-9,제주특별자치도 제주시 이도이동 2034-9,1157629793
5013,뜰에하우스,제주특별자치도 제주시 애월읍 곽지서길 9-2,제주특별자치도 제주시 애월읍 곽지리 2139-2,제주특별자치도 제주시 애월읍 곽지리 2139-2,1125079792
5014,에이바우트 커피 중문점,제주특별자치도 서귀포시 천제연로 184-1,제주특별자치도 서귀포시 중문동 2119-4,제주특별자치도 서귀포시 중문동 2119-4,1490656207
5015,바리 뫼오름,,제주특별자치도 제주시 애월읍 상가리 산 121,제주특별자치도 제주시 애월읍 상가리 산 121,no
5016,제주축산진흥원 제주마 방목지,제주특별자치도 제주시 516로 2480,제주특별자치도 제주시 용강동 산 14-34,제주특별자치도 제주시 용강동 산 14-34,17009126
5017,보물선,제주특별자치도 제주시 동한두기길 27,제주특별자치도 제주시 용담일동 424,제주특별자치도 제주시 용담일동 424,35363162
5018,파리바게뜨 제주 애월점,제주특별자치도 제주시 애월읍 애월로 89,제주특별자치도 제주시 애월읍 애월리 2062,제주특별자치도 제주시 애월읍 애월리 2062,821071792
5019,검은 쇠 몰고 오는,제주특별자치도 제주시 신대로20길 27,제주특별자치도 제주시 연동 296-7,제주특별자치도 제주시 연동 296-7,16831484
5020,이길 스테이,제주특별자치도 제주시 한림읍 한림로 481,제주특별자치도 제주시 한림읍 옹포리 585-3,제주특별자치도 제주시 한림읍 옹포리 585-3,no
5021,피플 카페,제주특별자치도 제주시 조천읍 신촌북3길 58,제주특별자치도 제주시 조천읍 신촌리 2405-8,제주특별자치도 제주시 조천읍 신촌리 2405-8,1849597025
5022,세븐일레븐 서귀포 성산시흥점,제주특별자치도 서귀포시 성산읍 시흥상동로 64,제주특별자치도 서귀포시 성산읍 시흥리 1052-1,제주특별자치도 서귀포시 성산읍 시흥리 1052-1,1808534847
5023,오조 마을,,제주특별자치도 서귀포시 성산읍 오조리,제주특별자치도 서귀포시 성산읍 오조리,11609038
5024,대수산봉,,제주특별자치도 서귀포시 성산읍 고성리 2039-1,제주특별자치도 서귀포시 성산읍 고성리 2039-1,17078395
5025,온평포구,,제주특별자치도 서귀포시 성산읍 온평리,제주특별자치도 서귀포시 성산읍 온평리,1044107305
5026,신풍 신천 바다목장길,,제주특별자치도 서귀포시 성산읍 신풍리 29,제주특별자치도 서귀포시 성산읍 신풍리 29,no
5027,신산리 마을카페,제주특별자치도 서귀포시 성산읍 환해장성로 33,제주특별자치도 서귀포시 성산읍 신산리 1130-2,제주특별자치도 서귀포시 성산읍 신산리 1130-2,37018261
5028,신산환해장성,,제주특별자치도 서귀포시 성산읍 신산리 49-5,제주특별자치도 서귀포시 성산읍 신산리 49-5,no
5029,분 식후경,제주특별자치도 서귀포시 성산읍 온평포구로62번길 22-1,제주특별자치도 서귀포시 성산읍 온평리 1110-4,제주특별자치도 서귀포시 성산읍 온평리 1110-4,1547091701
5030,통오름,,제주특별자치도 서귀포시 성산읍 난산리 1976-1,제주특별자치도 서귀포시 성산읍 난산리 1976-1,17079890
5031,독자봉,,제주특별자치도 서귀포시 성산읍 신산리 1785,제주특별자치도 서귀포시 성산읍 신산리 1785,17080082
5032,달빛에 구운 고등어 제주이도점,제주특별자치도 제주시 중앙로 381,제주특별자치도 제주시 이도이동 1986-8,제주특별자치도 제주시 이도이동 1986-8,1794833929
5033,마담도,제주특별자치도 서귀포시 신서로 69,제주특별자치도 서귀포시 강정동 1416-3,제주특별자치도 서귀포시 강정동 1416-3,no
5034,돈사향 올레시장 본점,제주특별자치도 서귀포시 천지로 20,제주특별자치도 서귀포시 서귀동 295-27,제주특별자치도 서귀포시 서귀동 295-27,1889945487
5035,수진 돌솥밥,제주특별자치도 서귀포시 중앙로62번길 4,제주특별자치도 서귀포시 서귀동 291-37,제주특별자치도 서귀포시 서귀동 291-37,16970478
5036,갈치 요리 전문점 만족한 상회,제주특별자치도 서귀포시 중문상로 58-5,제주특별자치도 서귀포시 중문동 1665-5,제주특별자치도 서귀포시 중문동 1665-5,1067329506
5037,제스 코메트 서귀포지점,제주특별자치도 서귀포시 상효로 39,제주특별자치도 서귀포시 상효동 754-1,제주특별자치도 서귀포시 상효동 754-1,1828315827
5038,이어도 식당,제주특별자치도 서귀포시 표선면 성읍정의현로22번길 10-1,제주특별자치도 서귀포시 표선면 성읍리 987-15,제주특별자치도 서귀포시 표선면 성읍리 987-15,no
5039,제주 어멍 통갈치 제주공항 본점,제주특별자치도 제주시 서해안로 372,제주특별자치도 제주시 용담삼동 2576-3,제주특별자치도 제주시 용담삼동 2576-3,1027565485
5040,순희네,제주특별자치도 서귀포시 대정읍 하모항구로6번길 29,제주특별자치도 서귀포시 대정읍 하모리 2127,제주특별자치도 서귀포시 대정읍 하모리 2127,1729666281
5041,괸당포차,제주특별자치도 서귀포시 부두로 29-1,제주특별자치도 서귀포시 서귀동 726-7,제주특별자치도 서귀포시 서귀동 726-7,1220458383
5042,제주 미작,제주특별자치도 제주시 한림읍 협재8길 22,제주특별자치도 제주시 한림읍 협재리 1825-1,제주특별자치도 제주시 한림읍 협재리 1825-1,no
5043,블루크랩 제주,제주특별자치도 제주시 조천읍 함덕로 40,제주특별자치도 제주시 조천읍 함덕리 산 14-13,제주특별자치도 제주시 조천읍 함덕리 산 14-13,1835918099
5044,제주 프렌드 렌터카 통합 배반 차센터,제주특별자치도 제주시 서해안로 442-53,제주특별자치도 제주시 용담삼동 2220,제주특별자치도 제주시 용담삼동 2220,1490103207
5045,리부 아르,제주특별자치도 제주시 애월읍 애월해안로 686,제주특별자치도 제주시 애월읍 구엄리 1258-8,제주특별자치도 제주시 애월읍 구엄리 1258-8,1258089808
5046,아띠랑스,제주특별자치도 서귀포시 성산읍 해맞이해안로 2614,제주특별자치도 서귀포시 성산읍 시흥리 10,제주특별자치도 서귀포시 성산읍 시흥리 10,1409775176
5047,윤슬,제주특별자치도 제주시 구좌읍 김녕로17길 30,제주특별자치도 제주시 구좌읍 김녕리 1267-8,제주특별자치도 제주시 구좌읍 김녕리 1267-8,1632836635
5048,도그모루,제주특별자치도 제주시 조천읍 함선로 142-3,제주특별자치도 제주시 조천읍 대흘리 101-2,제주특별자치도 제주시 조천읍 대흘리 101-2,1319173977
5049,어영소공원 화장실,제주특별자치도 제주시 서해안로 451,제주특별자치도 제주시 용담삼동 2396-2,제주특별자치도 제주시 용담삼동 2396-2,1605747384
5050,제주 시청,제주특별자치도 제주시 광양9길 10,제주특별자치도 제주시 이도이동 1176-1,제주특별자치도 제주시 이도이동 1176-1,11627882
5051,나디아 펜션,제주특별자치도 제주시 애월읍 애원로 74,제주특별자치도 제주시 애월읍 애월리 1229-3,제주특별자치도 제주시 애월읍 애월리 1229-3,37387625
5052,제주 시범바다목장,제주특별자치도 제주시 한경면 한경해안로 565,제주특별자치도 제주시 한경면 신창리 542-9,제주특별자치도 제주시 한경면 신창리 542-9,1670651626
5053,기흥어물,제주특별자치도 서귀포시 중정로61번길 6,제주특별자치도 서귀포시 서귀동 274-1,제주특별자치도 서귀포시 서귀동 274-1,30839724
5054,서귀포시 축협 축산물 플라자 성산점,제주특별자치도 서귀포시 성산읍 섭지코지로25번길 120,제주특별자치도 서귀포시 성산읍 고성리 229,제주특별자치도 서귀포시 성산읍 고성리 229,1779425423
5055,러브레시피 스튜디오,제주특별자치도 서귀포시 성산읍 신고로22번길 16,제주특별자치도 서귀포시 성산읍 고성리 511-15,제주특별자치도 서귀포시 성산읍 고성리 511-15,1331549290
5056,떠돌이 식객 열우니 키친,제주특별자치도 서귀포시 성산읍 신고로22번길 37,제주특별자치도 서귀포시 성산읍 고성리 212-6,제주특별자치도 서귀포시 성산읍 고성리 212-6,36606104
5057,제주 국제공항 공항 전망대,제주특별자치도 제주시 공항로 2,제주특별자치도 제주시 용담이동 2002,제주특별자치도 제주시 용담이동 2002,11576965
5058,웅담 식당,제주특별자치도 서귀포시 중앙로59번길 5,제주특별자치도 서귀포시 천지동 295-3,제주특별자치도 서귀포시 천지동 295-3,no
5059,카페 숲 숲,제주특별자치도 서귀포시 보목로64번길 80,제주특별자치도 서귀포시 보목동 1377-1,제주특별자치도 서귀포시 보목동 1377-1,1702042138
5060,선 헤어 아티스트 미용실,제주특별자치도 서귀포시 중앙로59번길 21,제주특별자치도 서귀포시 서귀동 309-8,제주특별자치도 서귀포시 서귀동 309-8,17042496
5061,서문 뒷고기,제주특별자치도 제주시 중앙로14길 40-2,제주특별자치도 제주시 삼도2동 821-2,제주특별자치도 제주시 삼도2동 821-2,16732432
5062,너랑나랑 게스트하우스,제주특별자치도 서귀포시 안덕면 화순해안로 40,제주특별자치도 서귀포시 안덕면 화순리 893-6,제주특별자치도 서귀포시 안덕면 화순리 893-6,1015626777
5063,더 리트리트,제주특별자치도 서귀포시 안덕면 화순로 67,제주특별자치도 서귀포시 안덕면 화순리 241,제주특별자치도 서귀포시 안덕면 화순리 241,741621665
5064,호텔 징크,제주특별자치도 서귀포시 중정로 11,제주특별자치도 서귀포시 서귀동 318-17,제주특별자치도 서귀포시 서귀동 318-17,1729770571
5065,순두부엔 짬뽕,제주특별자치도 제주시 통물길 30,제주특별자치도 제주시 외도일동 569-2,제주특별자치도 제주시 외도일동 569-2,no
5066,유메오르 펜션,제주특별자치도 제주시 조천읍 조함해안로 76-61,제주특별자치도 제주시 조천읍 조천리 944-4,제주특별자치도 제주시 조천읍 조천리 944-4,1016486488
5067,태돈가,제주특별자치도 제주시 무근성7길 37,제주특별자치도 제주시 삼도이동 1112-22,제주특별자치도 제주시 삼도이동 1112-22,1116701601
5068,바당 국수,제주특별자치도 서귀포시 동문동로 21-1,제주특별자치도 서귀포시 서귀동 269-21,제주특별자치도 서귀포시 서귀동 269-21,38233211
5069,서호 메디치,제주특별자치도 서귀포시 서호상로 46,제주특별자치도 서귀포시 서호동 611-1,제주특별자치도 서귀포시 서호동 611-1,1546419302
5070,성산 덕이네,제주특별자치도 서귀포시 성산읍 온평애향로 69-1,제주특별자치도 서귀포시 성산읍 온평리 747,제주특별자치도 서귀포시 성산읍 온평리 747,1259730535
5071,더 컨테이너,제주특별자치도 서귀포시 남원읍 태위로510번길 49,제주특별자치도 서귀포시 남원읍 남원리 2406-3,제주특별자치도 서귀포시 남원읍 남원리 2406-3,1823105073
5072,제주올레 18코스 공식 안내소,제주특별자치도 제주시 관덕로8길 7-9,제주특별자치도 제주시 일도일동 1448,제주특별자치도 제주시 일도일동 1448,no
5073,붉은 오름 자연휴양림 숲속 야영장,,제주특별자치도 서귀포시 표선면 가시리 산 158,제주특별자치도 서귀포시 표선면 가시리 산 158,31874899
5074,폴라인 제주 평대점,제주특별자치도 제주시 구좌읍 평대2길 34-3,제주특별자치도 제주시 구좌읍 평대리 1984-1,제주특별자치도 제주시 구좌읍 평대리 1984-1,1513822755
5075,영락 마을회관 국수 연동 본점,제주특별자치도 제주시 신대로16길 37-1,제주특별자치도 제주시 연동 283-50,제주특별자치도 제주시 연동 283-50,1080528041
5076,삼무곱창 흑돼지 연동점,제주특별자치도 제주시 삼무로 38,제주특별자치도 제주시 연동 272-3,제주특별자치도 제주시 연동 272-3,1057318216
5077,탐앤탐스 김녕 아쿠아점,제주특별자치도 제주시 구좌읍 일주동로 1921,제주특별자치도 제주시 구좌읍 김녕리 4195,제주특별자치도 제주시 구좌읍 김녕리 4195,1371338738
5078,오야마,제주특별자치도 제주시 광양13길 11,제주특별자치도 제주시 이도이동 1179-22,제주특별자치도 제주시 이도이동 1179-22,35239203
5079,미완성,제주특별자치도 서귀포시 대정읍 도원로 39-7,제주특별자치도 서귀포시 대정읍 신도리 2978-3,제주특별자치도 서귀포시 대정읍 신도리 2978-3,1954514202
5080,단당류,제주특별자치도 제주시 한경면 녹차분재로 514,제주특별자치도 제주시 한경면 저지리 3012-1,제주특별자치도 제주시 한경면 저지리 3012-1,1303266720
5081,인디고 인디즈,제주특별자치도 제주시 애월읍 애월해안로 204,제주특별자치도 제주시 애월읍 고내리 1218-1,제주특별자치도 제주시 애월읍 고내리 1218-1,36744970
5082,달다 제주 소품숍,제주특별자치도 제주시 조천읍 조함해안로 9,제주특별자치도 제주시 조천읍 조천리 2593-3,제주특별자치도 제주시 조천읍 조천리 2593-3,1314881006
5083,365식자재마트,제주특별자치도 서귀포시 성산읍 고성오조로 18,제주특별자치도 서귀포시 성산읍 고성리 1001,제주특별자치도 서귀포시 성산읍 고성리 1001,1344836680
5084,송악산 공영주차장,,제주특별자치도 서귀포시 대정읍 상모리 165,제주특별자치도 서귀포시 대정읍 상모리 165,no
5085,제주 흑돼지 복덩이,제주특별자치도 서귀포시 성산읍 일출로 34,제주특별자치도 서귀포시 성산읍 고성리 329-8,제주특별자치도 서귀포시 성산읍 고성리 329-8,35813091
5086,소노벨 제주 해난디,제주특별자치도 제주시 조천읍 신북로 577,제주특별자치도 제주시 조천읍 함덕리 274,제주특별자치도 제주시 조천읍 함덕리 274,12896850
5087,제주 코코몽 에코파크,제주특별자치도 서귀포시 남원읍 태위로 536,제주특별자치도 서귀포시 남원읍 남원리 2380,제주특별자치도 서귀포시 남원읍 남원리 2380,no
5088,표선 갈치어장,제주특별자치도 서귀포시 표선면 표선당포로 27,제주특별자치도 서귀포시 표선면 표선리 45-3,제주특별자치도 서귀포시 표선면 표선리 45-3,1792745599
5089,한림 칼국수 표선점,제주특별자치도 서귀포시 표선면 표선관정로117번길 1,제주특별자치도 서귀포시 표선면 표선리 780-1,제주특별자치도 서귀포시 표선면 표선리 780-1,1387044282
5090,마니주 펜션,제주특별자치도 제주시 서해안로 248,제주특별자치도 제주시 도두일동 1688-9,제주특별자치도 제주시 도두일동 1688-9,31549538
5091,퐁당 제주,해안로715-1 1층,,해안로715-1 1층,no
5092,동부레저,제주특별자치도 서귀포시 표선면 번영로 2454,제주특별자치도 서귀포시 표선면 성읍리 2873,제주특별자치도 서귀포시 표선면 성읍리 2873,no
5093,백스비어 서귀포 성산점,동류암로39-4 2층,,동류암로39-4 2층,1107003490
5094,김녕바이브,제주특별자치도 제주시 구좌읍 김녕항1길 2,제주특별자치도 제주시 구좌읍 김녕리 3936,제주특별자치도 제주시 구좌읍 김녕리 3936,1320369666
5095,성산포 흑돈 애,제주특별자치도 서귀포시 성산읍 한도로 67,제주특별자치도 서귀포시 성산읍 오조리 351-1,제주특별자치도 서귀포시 성산읍 오조리 351-1,37604438
5096,플레이스 캠프 제주,제주특별자치도 서귀포시 성산읍 동류암로 20,,제주특별자치도 서귀포시 성산읍 동류암로 20,38491317
5097,한옥집,제주특별자치도 서귀포시 서홍로 41,제주특별자치도 서귀포시 서홍동 1194-15,제주특별자치도 서귀포시 서홍동 1194-15,21410777
5098,단잠,제주특별자치도 제주시 한림읍 귀덕14길 56,제주특별자치도 제주시 한림읍 귀덕리 1364-1,제주특별자치도 제주시 한림읍 귀덕리 1364-1,no
5099,코시롱,제주특별자치도 제주시 노형1길 12-2,제주특별자치도 제주시 노형동 3808-1,제주특별자치도 제주시 노형동 3808-1,35566974
5100,카페 언더 라운지 제주 함덕점,제주특별자치도 제주시 조천읍 함덕로 40,제주특별자치도 제주시 조천읍 함덕리 산 14,제주특별자치도 제주시 조천읍 함덕리 산 14,11491805
5101,담백 함덕점,제주특별자치도 제주시 조천읍 함덕19길 9,제주특별자치도 제주시 조천읍 함덕리 960-7,제주특별자치도 제주시 조천읍 함덕리 960-7,1094394730
5102,팜스 빌리지,제주특별자치도 제주시 한림읍 귀덕7길 17,제주특별자치도 제주시 한림읍 귀덕리 3116,제주특별자치도 제주시 한림읍 귀덕리 3116,1287525693
5103,곽지해수욕장 교육원 앞 주차장,,제주특별자치도 제주시 애월읍 곽지리 1565,제주특별자치도 제주시 애월읍 곽지리 1565,37599232
5104,협재이길,제주특별자치도 제주시 한림읍 협재2길 14,제주특별자치도 제주시 한림읍 협재리 2021-4,제주특별자치도 제주시 한림읍 협재리 2021-4,1906181915
5105,어둑,제주특별자치도 제주시 한림읍 협재1길 53,제주특별자치도 제주시 한림읍 협재리 1451-1,제주특별자치도 제주시 한림읍 협재리 1451-1,1164862994
5106,파스토,제주특별자치도 제주시 한림읍 한림해안로 540,제주특별자치도 제주시 한림읍 귀덕리 3883,제주특별자치도 제주시 한림읍 귀덕리 3883,no
5107,포토이즘박스 곽지해변점,제주특별자치도 제주시 애월읍 곽지3길 19,제주특별자치도 제주시 애월읍 곽지리 1575-13,제주특별자치도 제주시 애월읍 곽지리 1575-13,1325658366
5108,카페훤,제주특별자치도 제주시 한림읍 협재1길 8,제주특별자치도 제주시 한림읍 협재리 1717,제주특별자치도 제주시 한림읍 협재리 1717,1089501834
5109,엘리사,제주특별자치도 제주시 애월읍 가문동상2길 28,제주특별자치도 제주시 애월읍 하귀2리 2753-3,제주특별자치도 제주시 애월읍 하귀2리 2753-3,1117752864
5110,이일 티오 카페,제주특별자치도 제주시 은남1길 21,제주특별자치도 제주시 연동 292-11,제주특별자치도 제주시 연동 292-11,1136582245
5111,배가본드,제주특별자치도 제주시 관덕로15길 9,제주특별자치도 제주시 일도일동 1333-2,제주특별자치도 제주시 일도일동 1333-2,1443793937
5112,호텔 리젠트 마린,제주특별자치도 제주시 서부두2길 20,,제주특별자치도 제주시 서부두2길 20,37281659
5113,제주베아툼스파앤풀빌라,제주특별자치도 제주시 구좌읍 해맞이해안로 2486-21,제주특별자치도 제주시 구좌읍 종달리 659,제주특별자치도 제주시 구좌읍 종달리 659,1588615059
5114,고요히,제주특별자치도 서귀포시 성산읍 온평상하로59번길 18,제주특별자치도 서귀포시 성산읍 온평리 769-1,제주특별자치도 서귀포시 성산읍 온평리 769-1,no
5115,스테이 셀레네,제주특별자치도 제주시 구좌읍 행원로7길 25-1,제주특별자치도 제주시 구좌읍 행원리 589,제주특별자치도 제주시 구좌읍 행원리 589,1237286457
5116,한라 전복 성산 본점,제주특별자치도 서귀포시 성산읍 해맞이해안로 2732,제주특별자치도 서귀포시 성산읍 오조리 376,제주특별자치도 서귀포시 성산읍 오조리 376,16949379
5117,칠돈가 제주공항 직영점,제주특별자치도 제주시 신대로 144,제주특별자치도 제주시 연동 304-11,제주특별자치도 제주시 연동 304-11,no
5118,하우 마을 레저,연평리 2384-5,,연평리 2384-5,1630693380
5119,원조 우도땅콩 아이스크림,우도해안길 86,,우도해안길 86,no
5120,하우 목동 하이,제주특별자치도 제주시 우도면 우도해안길 352,,제주특별자치도 제주시 우도면 우도해안길 352,no
5121,블룸 호텔,제주특별자치도 서귀포시 중문관광로72번길 53,제주특별자치도 서귀포시 색달동 2812-2,제주특별자치도 서귀포시 색달동 2812-2,1736530594
5122,스시 망고,제주특별자치도 서귀포시 1100로 171,제주특별자치도 서귀포시 회수동 440-5,제주특별자치도 서귀포시 회수동 440-5,1475860849
5123,BHC치킨 중문점,제주특별자치도 서귀포시 중문관광로72번길 29-9,제주특별자치도 서귀포시 색달동 2822-2,제주특별자치도 서귀포시 색달동 2822-2,782189414
5124,고포잇다이브 스쿠버다이빙,제주특별자치도 서귀포시 이어도로 685-1,제주특별자치도 서귀포시 강정동 2628-1,제주특별자치도 서귀포시 강정동 2628-1,no
5125,중문향아로마,제주특별자치도 서귀포시 천제연로 183,제주특별자치도 서귀포시 중문동 2084-1,제주특별자치도 서귀포시 중문동 2084-1,1568986375
5126,그라나다,제주특별자치도 제주시 1100로 3308,제주특별자치도 제주시 노형동 709,제주특별자치도 제주시 노형동 709,no
5127,헤이 서귀포,제주특별자치도 서귀포시 태평로 363,,제주특별자치도 서귀포시 태평로 363,1639869302
5128,남도 고기국수,제주특별자치도 서귀포시 명동로 26,제주특별자치도 서귀포시 서귀동 416-2,제주특별자치도 서귀포시 서귀동 416-2,1076327896
5129,벙커하우스,제주특별자치도 서귀포시 막숙포로41번길 66,제주특별자치도 서귀포시 법환동 140,제주특별자치도 서귀포시 법환동 140,1160705436
5130,삼총사 횟집 성산점,제주특별자치도 서귀포시 성산읍 일출로 32,제주특별자치도 서귀포시 성산읍 고성리 331-3,제주특별자치도 서귀포시 성산읍 고성리 331-3,1402063288
5131,우도 도하선 선착장,제주특별자치도 제주시 구좌읍 해맞이해안로 2274,제주특별자치도 제주시 구좌읍 종달리 478-10,제주특별자치도 제주시 구좌읍 종달리 478-10,no
5132,성산항 공영주차장 전기차 충전소,제주특별자치도 서귀포시 성산읍 성산등용로 112-7,제주특별자치도 서귀포시 성산읍 성산리 347-9,제주특별자치도 서귀포시 성산읍 성산리 347-9,1220310782
5133,998서프,제주특별자치도 제주시 선사로8길 33,제주특별자치도 제주시 삼양일동 1599-39,제주특별자치도 제주시 삼양일동 1599-39,1327760321
5134,달이머물다 게스트하우스,제주특별자치도 제주시 구좌읍 해맞이해안로 518-38,제주특별자치도 제주시 구좌읍 행원리 1511-3,제주특별자치도 제주시 구좌읍 행원리 1511-3,no
5135,후프 바비큐,제주특별자치도 제주시 애월읍 애월북서길 69,제주특별자치도 제주시 애월읍 애월리 2519-7,제주특별자치도 제주시 애월읍 애월리 2519-7,1114393203
