,VISIT_AREA_NM,ROAD_NM_ADDR,LOTNO_ADDR,SEARCH_ADDR,data-id
1593,휴일로,제주특별자치도 서귀포시 안덕면 난드르로 49-65,제주특별자치도 서귀포시 안덕면 창천리 786,제주특별자치도 서귀포시 안덕면 창천리 786,1277648050
1594,몽돌리조트,제주특별자치도 제주시 주르레길 23,제주특별자치도 제주시 노형동 289-37,제주특별자치도 제주시 노형동 289-37,1029455751
1595,제주동문재래 야시장,제주특별자치도 제주시 관덕로14길 20,제주특별자치도 제주시 이도일동 1436-7,제주특별자치도 제주시 이도일동 1436-7,11616005
1596,온더스톤 브런치 카페,제주특별자치도 서귀포시 성산읍 해맞이해안로 2746,제주특별자치도 서귀포시 성산읍 오조리 374,제주특별자치도 서귀포시 성산읍 오조리 374,1623498880
1597,커큐민 흑돼지,제주특별자치도 서귀포시 성산읍 일출로 84,제주특별자치도 서귀포시 성산읍 고성리 236,제주특별자치도 서귀포시 성산읍 고성리 236,35221577
1598,범하다,제주특별자치도 서귀포시 성산읍 일주동로 4675,제주특별자치도 서귀포시 성산읍 온평리 595-6,제주특별자치도 서귀포시 성산읍 온평리 595-6,no
1599,네거리식당,제주특별자치도 서귀포시 서문로29번길 20,제주특별자치도 서귀포시 서귀동 320-9,제주특별자치도 서귀포시 서귀동 320-9,19873758
1600,스타벅스 성산 일출봉점,제주특별자치도 서귀포시 성산읍 일출로 284-5,제주특별자치도 서귀포시 성산읍 성산리 109-11,제주특별자치도 서귀포시 성산읍 성산리 109-11,31317203
1601,하라케케,제주특별자치도 서귀포시 속골로 29-10,제주특별자치도 서귀포시 호근동 1638-2,제주특별자치도 서귀포시 호근동 1638-2,1214681781
1602,제이팝 휴양펜션,제주특별자치도 서귀포시 일주서로 505,제주특별자치도 서귀포시 하원동 1401,제주특별자치도 서귀포시 하원동 1401,no
1603,카페 2472,제주특별자치도 서귀포시 천제연로 103-15,제주특별자치도 서귀포시 색달동 2472-1,제주특별자치도 서귀포시 색달동 2472-1,no
1604,서귀포 동경 가락국수 본점,제주특별자치도 서귀포시 중앙로89번길 4,제주특별자치도 서귀포시 서귀동 301-19,제주특별자치도 서귀포시 서귀동 301-19,16899755
1605,그대가 사는 시간,제주특별자치도 서귀포시 칠십리로 288,제주특별자치도 서귀포시 토평동 634-4,제주특별자치도 서귀포시 토평동 634-4,1692587163
1606,신해바라기 분식 본점,제주특별자치도 제주시 관덕로13길 13,제주특별자치도 제주시 일도1동 1342-4,제주특별자치도 제주시 일도1동 1342-4,20507945
1607,게으른 소나기,제주특별자치도 제주시 구좌읍 계룡길 45-6,제주특별자치도 제주시 구좌읍 한동리 1287-4,제주특별자치도 제주시 구좌읍 한동리 1287-4,30847223
1608,말젯문,제주특별자치도 제주시 구좌읍 계룡길 31,제주특별자치도 제주시 구좌읍 한동리 10-38,제주특별자치도 제주시 구좌읍 한동리 10-38,38484059
1609,우도머뭄,제주특별자치도 제주시 우도면 조일길 44,제주특별자치도 제주시 우도면 연평리 156-1,제주특별자치도 제주시 우도면 연평리 156-1,1572285114
1610,카페 살레,제주특별자치도 제주시 우도면 우도해안길 816,제주특별자치도 제주시 우도면 연평리 1290-2,제주특별자치도 제주시 우도면 연평리 1290-2,1811092583
1611,밤수지맨드라미,제주특별자치도 제주시 우도면 우도해안길 530,제주특별자치도 제주시 우도면 연평리 860,제주특별자치도 제주시 우도면 연평리 860,684854462
1612,바다를 바라보면,제주특별자치도 제주시 구좌읍 월정1길 47-1,제주특별자치도 제주시 구좌읍 월정리 421-1,제주특별자치도 제주시 구좌읍 월정리 421-1,1269389743
1613,르바게트,제주특별자치도 제주시 구좌읍 월정1길 30,제주특별자치도 제주시 구좌읍 월정리 348-1,제주특별자치도 제주시 구좌읍 월정리 348-1,no
1614,호텔 스위트 캐슬,제주특별자치도 제주시 조천읍 신북로 443,제주특별자치도 제주시 조천읍 함덕리 3230-1,제주특별자치도 제주시 조천읍 함덕리 3230-1,1659262588
1615,사가냥,제주특별자치도 제주시 조천읍 신북로 453,제주특별자치도 제주시 조천읍 함덕리 3215-6,제주특별자치도 제주시 조천읍 함덕리 3215-6,1465218625
1616,올레길 19코스(조천-김녕 올레),,제주특별자치도 제주시 조천읍 조천리 1142,제주특별자치도 제주시 조천읍 조천리 1142,no
1617,괸당집 함덕점,제주특별자치도 제주시 조천읍 신북로 509,제주특별자치도 제주시 조천읍 함덕리 1252-2,제주특별자치도 제주시 조천읍 함덕리 1252-2,1792450574
1618,소사 오름,제주특별자치도 제주시 한림읍 금능길 61,제주특별자치도 제주시 한림읍 금능리 1393,제주특별자치도 제주시 한림읍 금능리 1393,1001891384
1619,프롬나드 제주,제주특별자치도 제주시 한경면 금등4길 96,제주특별자치도 제주시 한경면 금등리 485-3,제주특별자치도 제주시 한경면 금등리 485-3,1420017169
1620,수리고,제주특별자치도 제주시 한경면 조수설목1길 8,제주특별자치도 제주시 한경면 조수리 1085,제주특별자치도 제주시 한경면 조수리 1085,1573082468
1621,꼬뜨 웨스트,제주특별자치도 제주시 한경면 대한로 800-2,제주특별자치도 제주시 한경면 청수리 1092-4,제주특별자치도 제주시 한경면 청수리 1092-4,1007877388
1622,황해 식당,제주특별자치도 제주시 우정로 6,제주특별자치도 제주시 외도일동 418-9,제주특별자치도 제주시 외도일동 418-9,no
1623,라라카페 애월점,제주특별자치도 제주시 애월읍 광령평화10길 13,제주특별자치도 제주시 애월읍 광령리 160-1,제주특별자치도 제주시 애월읍 광령리 160-1,1716633433
1624,다이소 서귀포점,제주특별자치도 서귀포시 동홍서로 49,제주특별자치도 서귀포시 동홍동 642-1,제주특별자치도 서귀포시 동홍동 642-1,12900079
1625,용머리해안 매표소,,제주특별자치도 서귀포시 안덕면 사계리 112-3,제주특별자치도 서귀포시 안덕면 사계리 112-3,21251675
1626,꺼멍집,제주특별자치도 제주시 애월읍 중산간서로 6716,제주특별자치도 제주시 애월읍 광령리 19-7,제주특별자치도 제주시 애월읍 광령리 19-7,38767024
1627,제주 샹그릴라호텔앤 리조트,제주특별자치도 제주시 해안마을북길 14-6,제주특별자치도 제주시 해안동 2101-3,제주특별자치도 제주시 해안동 2101-3,36605874
1628,국립제주박물관,제주특별자치도 제주시 일주동로 17,제주특별자치도 제주시 건입동 261,제주특별자치도 제주시 건입동 261,11621150
1629,새 한라 회관,제주특별자치도 제주시 한림읍 문교길 8,제주특별자치도 제주시 한림읍 한림리 940-4,제주특별자치도 제주시 한림읍 한림리 940-4,16861676
1630,호박 게스트하우스,제주특별자치도 제주시 한림읍 금능길 20-6,제주특별자치도 제주시 한림읍 금능리 1768,제주특별자치도 제주시 한림읍 금능리 1768,35003445
1631,사계 전복,제주특별자치도 서귀포시 안덕면 사계로 207,제주특별자치도 서귀포시 안덕면 사계리 933,제주특별자치도 서귀포시 안덕면 사계리 933,1244382800
1632,협재 섬 바다,제주특별자치도 제주시 한림읍 금능남로 53,제주특별자치도 제주시 한림읍 협재리 2765-5,제주특별자치도 제주시 한림읍 협재리 2765-5,1681498778
1633,제주 불빛 정원,제주특별자치도 제주시 애월읍 평화로 2346,제주특별자치도 제주시 애월읍 유수암리 1083,제주특별자치도 제주시 애월읍 유수암리 1083,876072168
1634,보유,제주특별자치도 서귀포시 안덕면 중산간서로 1817,제주특별자치도 서귀포시 안덕면 서광리 280-1,제주특별자치도 서귀포시 안덕면 서광리 280-1,no
1635,제주 바닷가의 나루터,제주특별자치도 제주시 서해안로 634,제주특별자치도 제주시 용담삼동 1003-1,제주특별자치도 제주시 용담삼동 1003-1,no
1636,제주공항 길 펜션,제주특별자치도 제주시 용마서길 24-11,제주특별자치도 제주시 용담삼동 967-1,제주특별자치도 제주시 용담삼동 967-1,no
1637,산지 등대,제주특별자치도 제주시 사라봉동길 108-1,제주특별자치도 제주시 건입동 340-2,제주특별자치도 제주시 건입동 340-2,1260912808
1638,이호 테우 등대,,제주특별자치도 제주시 이호일동 374-5,제주특별자치도 제주시 이호일동 374-5,1470243691
1639,동남탕,제주특별자치도 서귀포시 성산읍 고성동서로56번길 4,제주특별자치도 서귀포시 성산읍 고성리 1132-22,제주특별자치도 서귀포시 성산읍 고성리 1132-22,794472233
1640,까사로마호텔,제주특별자치도 서귀포시 태평로 347,제주특별자치도 서귀포시 서귀동 314-2,제주특별자치도 서귀포시 서귀동 314-2,1876347541
1641,무지개 렌터카 주차장,,제주특별자치도 제주시 도두이동 1121-1,제주특별자치도 제주시 도두이동 1121-1,no
1642,샐리스 제주,제주특별자치도 제주시 애월읍 고내로 46,제주특별자치도 제주시 애월읍 하가리 1256-2,제주특별자치도 제주시 애월읍 하가리 1256-2,37917639
1643,해오반 애월점,제주특별자치도 제주시 애월읍 고내로9길 1,제주특별자치도 제주시 애월읍 고내리 598-1,제주특별자치도 제주시 애월읍 고내리 598-1,1127091708
1644,제주도 서핑 숍 문이 서프(서핑),제주특별자치도 제주시 애월읍 곽지7길 1,제주특별자치도 제주시 애월읍 곽지리 1635,제주특별자치도 제주시 애월읍 곽지리 1635,37746343
1645,숙성도 중문점,제주특별자치도 서귀포시 일주서로 966,제주특별자치도 서귀포시 색달동 2123,제주특별자치도 서귀포시 색달동 2123,1146342571
1646,군산오름 등산로 입구,,제주특별자치도 서귀포시 상예동 4853-4,제주특별자치도 서귀포시 상예동 4853-4,no
1647,샐리스 제주(수영),제주특별자치도 제주시 애월읍 고내로 46,제주특별자치도 제주시 애월읍 하가리 1256-2,제주특별자치도 제주시 애월읍 하가리 1256-2,37917639
1648,색달바당,제주특별자치도 서귀포시 색달로 99,제주특별자치도 서귀포시 색달동 1898-1,제주특별자치도 서귀포시 색달동 1898-1,1089452165
1649,난산리식당,제주특별자치도 서귀포시 성산읍 난산로41번길 38,제주특별자치도 서귀포시 성산읍 난산리 1054-1,제주특별자치도 서귀포시 성산읍 난산리 1054-1,1647776993
1650,장가네 해장국,,제주특별자치도 서귀포시 중문동 2128-1,제주특별자치도 서귀포시 중문동 2128-1,38258469
1651,역전 할머니 맥주 제주 서귀동점,제주특별자치도 서귀포시 명동로 13-1,제주특별자치도 서귀포시 서귀동 420-10,제주특별자치도 서귀포시 서귀동 420-10,1195490505
1652,제주해조네보말성게전문점,제주특별자치도 서귀포시 안덕면 대평감산로 12,제주특별자치도 서귀포시 안덕면 창천리 876-4,제주특별자치도 서귀포시 안덕면 창천리 876-4,265144987
1653,올레 마당,제주특별자치도 서귀포시 안덕면 사계남로 224,제주특별자치도 서귀포시 안덕면 사계리 135-1,제주특별자치도 서귀포시 안덕면 사계리 135-1,37673553
1654,텐보이,제주특별자치도 서귀포시 안덕면 사계북로 95,제주특별자치도 서귀포시 안덕면 사계리 2977-1,제주특별자치도 서귀포시 안덕면 사계리 2977-1,1435580853
1655,뽈살집 한림점,제주특별자치도 제주시 한림읍 한림상로 194,제주특별자치도 제주시 한림읍 한림리 1252-8,제주특별자치도 제주시 한림읍 한림리 1252-8,1330534461
1656,제주 환상 전 기 자전거,제주특별자치도 제주시 한경면 한경해안로 97,제주특별자치도 제주시 한경면 용수리 4541-8,제주특별자치도 제주시 한경면 용수리 4541-8,38273360
1657,1미리 게스트하우스,제주특별자치도 제주시 한림읍 협재6길 22-4,제주특별자치도 제주시 한림읍 협재리 1763-3,제주특별자치도 제주시 한림읍 협재리 1763-3,no
1658,GS25 협재해변점,제주특별자치도 제주시 한림읍 한림로 349,제주특별자치도 제주시 한림읍 협재리 2447-1,제주특별자치도 제주시 한림읍 협재리 2447-1,1539360901
1659,고요 산책,제주특별자치도 제주시 중앙로12길 5,제주특별자치도 제주시 이도일동 1387-3,제주특별자치도 제주시 이도일동 1387-3,1311631245
1660,중국집 마씸,제주특별자치도 제주시 한경면 두신로 78,제주특별자치도 제주시 한경면 신창리 261-3,제주특별자치도 제주시 한경면 신창리 261-3,37646528
1661,귤귤스토어,제주특별자치도 제주시 애월읍 애월로1길 6,제주특별자치도 제주시 애월읍 애월리 2501,제주특별자치도 제주시 애월읍 애월리 2501,no
1662,장한 철 생가,제주특별자치도 제주시 애월읍 애월로1길 26,제주특별자치도 제주시 애월읍 애월리 2532,제주특별자치도 제주시 애월읍 애월리 2532,1201432301
1663,제주 카약 올레,제주특별자치도 제주시 애월읍 애월로1길 22,제주특별자치도 제주시 애월읍 애월리 2490-1,제주특별자치도 제주시 애월읍 애월리 2490-1,21873408
1664,더클리프,제주특별자치도 서귀포시 중문관광로 154-17,제주특별자치도 서귀포시 색달동 2950-4,제주특별자치도 서귀포시 색달동 2950-4,no
1665,팜트리 빌리지,제주특별자치도 서귀포시 남원읍 남원월산로74번길 101-28,제주특별자치도 서귀포시 남원읍 남원리 1188-3,제주특별자치도 서귀포시 남원읍 남원리 1188-3,1212214995
1666,몸냥식탁,제주특별자치도 서귀포시 천제연로 172-3,제주특별자치도 서귀포시 중문동 2117-5,제주특별자치도 서귀포시 중문동 2117-5,no
1667,초원 주유소,제주특별자치도 서귀포시 일주서로 27,제주특별자치도 서귀포시 강정동 252-1,제주특별자치도 서귀포시 강정동 252-1,13283115
1668,베스트웨스턴 제주호텔,제주특별자치도 제주시 도령로 27,제주특별자치도 제주시 노형동 1295-16,제주특별자치도 제주시 노형동 1295-16,36868445
1669,국시트멍,제주특별자치도 제주시 진군길 31-3,제주특별자치도 제주시 노형동 738-7,제주특별자치도 제주시 노형동 738-7,32812179
1670,델문도 김녕점,제주특별자치도 제주시 구좌읍 해맞이해안로 140,제주특별자치도 제주시 구좌읍 김녕리 462-15,제주특별자치도 제주시 구좌읍 김녕리 462-15,1276979145
1671,제파,제주특별자치도 제주시 구좌읍 월정3길 40,제주특별자치도 제주시 구좌읍 월정리 482-5,제주특별자치도 제주시 구좌읍 월정리 482-5,1264066793
1672,제주 남원농협 하나로마트,제주특별자치도 서귀포시 남원읍 남조로 52,제주특별자치도 서귀포시 남원읍 남원리 226,제주특별자치도 서귀포시 남원읍 남원리 226,13373133
1673,돈내코 손두부,제주특별자치도 서귀포시 배낭골로21번길 19,제주특별자치도 서귀포시 상효동 1403-9,제주특별자치도 서귀포시 상효동 1403-9,32868584
1674,모레기동 타잔,제주특별자치도 서귀포시 배낭골로21번길 13,제주특별자치도 서귀포시 상효동 1391-1,제주특별자치도 서귀포시 상효동 1391-1,no
1675,소금막해변,,제주특별자치도 서귀포시 표선면 표선리,제주특별자치도 서귀포시 표선면 표선리,no
1676,손길 다방,제주특별자치도 제주시 애월읍 소길2길 45-3,제주특별자치도 제주시 애월읍 소길리 619,제주특별자치도 제주시 애월읍 소길리 619,1714869681
1677,너븐,제주특별자치도 서귀포시 칠십리로214번길 26,제주특별자치도 서귀포시 동홍동 281-1,제주특별자치도 서귀포시 동홍동 281-1,1274239322
1678,조선 델리,제주특별자치도 서귀포시 중문관광로72번길 60,제주특별자치도 서귀포시 색달동 2785,제주특별자치도 서귀포시 색달동 2785,no
1679,부가네얼큰이 본점,제주특별자치도 제주시 신산로 46,제주특별자치도 제주시 일도이동 1031-1,제주특별자치도 제주시 일도이동 1031-1,1130505607
1680,야시장,제주특별자치도 제주시 신산로 37,제주특별자치도 제주시 일도2동 1020-11,제주특별자치도 제주시 일도2동 1020-11,no
1681,풀빌라 소랑,제주특별자치도 제주시 조천읍 곱은달남길 218,제주특별자치도 제주시 조천읍 대흘리 1089-12,제주특별자치도 제주시 조천읍 대흘리 1089-12,1784094520
1682,제주발 솔트,제주특별자치도 제주시 가령골3길 6,제주특별자치도 제주시 이도이동 317-9,제주특별자치도 제주시 이도이동 317-9,1531243212
1683,OHD 카페,제주특별자치도 제주시 구좌읍 중산간동로 1875,제주특별자치도 제주시 구좌읍 덕천리 1252,제주특별자치도 제주시 구좌읍 덕천리 1252,no
1684,윈스카이 호텔,제주특별자치도 서귀포시 신중남로 17,제주특별자치도 서귀포시 강정동 162-1,제주특별자치도 서귀포시 강정동 162-1,38513808
1685,제주 김만복 동문시장점,제주특별자치도 제주시 북성로 65,제주특별자치도 제주시 삼도이동 1158-36,제주특별자치도 제주시 삼도이동 1158-36,1784295871
1686,호텔 난타,제주특별자치도 제주시 선돌목동길 56-26,제주특별자치도 제주시 오등동 10-1,제주특별자치도 제주시 오등동 10-1,94636331
1687,오마 제주,제주특별자치도 서귀포시 중앙로79번길 8,제주특별자치도 서귀포시 서귀동 298-3,제주특별자치도 서귀포시 서귀동 298-3,1900873803
1688,스타벅스 제주공항 DT 점,제주특별자치도 제주시 월성로 42,제주특별자치도 제주시 용담이동 2754-1,제주특별자치도 제주시 용담이동 2754-1,no
1689,몽근 월정리점,제주특별자치도 제주시 구좌읍 해맞이해안로 400,제주특별자치도 제주시 구좌읍 월정리 670-3,제주특별자치도 제주시 구좌읍 월정리 670-3,1715341655
1690,한라산 아래 첫 마을 제주민속촌점,제주특별자치도 서귀포시 표선면 민속해안로 631-34,제주특별자치도 서귀포시 표선면 표선리 40-1,제주특별자치도 서귀포시 표선면 표선리 40-1,11590712
1691,호랑 호랑 카페,,제주특별자치도 서귀포시 성산읍 고성리 235,제주특별자치도 서귀포시 성산읍 고성리 235,1920330451
1692,졸대 체험승마,,제주특별자치도 서귀포시 성산읍 고성리 296-7,제주특별자치도 서귀포시 성산읍 고성리 296-7,1314205675
1693,봉기네 깡통구이,제주특별자치도 서귀포시 성산읍 고성오조로 38,제주특별자치도 서귀포시 성산읍 고성리 338-3,제주특별자치도 서귀포시 성산읍 고성리 338-3,1180683480
1694,해마루,제주특별자치도 서귀포시 성산읍 일출로 84,제주특별자치도 서귀포시 성산읍 고성리 236,제주특별자치도 서귀포시 성산읍 고성리 236,1825636217
1695,버거킹 제주 민속오일장 DT 점,제주특별자치도 제주시 일주서로 7802,제주특별자치도 제주시 연동 2413-4,제주특별자치도 제주시 연동 2413-4,1281833696
1696,머무르다,제주특별자치도 제주시 애월읍 금성1길 29-1,제주특별자치도 제주시 애월읍 금성리 567,제주특별자치도 제주시 애월읍 금성리 567,1249180604
1697,무인 제주,제주특별자치도 제주시 애월읍 금성5길 44-9,제주특별자치도 제주시 애월읍 금성리 472-8,제주특별자치도 제주시 애월읍 금성리 472-8,1150301644
1698,도르르 김밥,제주특별자치도 제주시 한림읍 일주서로 5903-6,제주특별자치도 제주시 한림읍 귀덕리 904-7,제주특별자치도 제주시 한림읍 귀덕리 904-7,1560373361
1699,상가리 사무소 전기차 충전소,제주특별자치도 제주시 애월읍 상가중길 23,제주특별자치도 제주시 애월읍 상가리 1196-1,제주특별자치도 제주시 애월읍 상가리 1196-1,16871253
1700,소길별하,제주특별자치도 제주시 애월읍 소길남길 34-37,제주특별자치도 제주시 애월읍 소길리 1056,제주특별자치도 제주시 애월읍 소길리 1056,1301612828
1701,퍼플 모스,제주특별자치도 제주시 애월읍 하귀로 53,제주특별자치도 제주시 애월읍 하귀2리 1878-3,제주특별자치도 제주시 애월읍 하귀2리 1878-3,1547603371
1702,호아 요가 숙소,제주특별자치도 제주시 애월읍 애월로2길 38,제주특별자치도 제주시 애월읍 애월리 2193,제주특별자치도 제주시 애월읍 애월리 2193,no
1703,애월 고불락,제주특별자치도 제주시 애월읍 고내로7길 45-12,제주특별자치도 제주시 애월읍 고내리 1164-1,제주특별자치도 제주시 애월읍 고내리 1164-1,16871522
1704,마틸다,제주특별자치도 제주시 애월읍 고내1길 33,제주특별자치도 제주시 애월읍 고내리 841,제주특별자치도 제주시 애월읍 고내리 841,36543262
1705,우진해장국,제주특별자치도 제주시 서사로 11,제주특별자치도 제주시 삼도이동 831,제주특별자치도 제주시 삼도이동 831,13418405
1706,올레 5 게스트하우스,제주특별자치도 서귀포시 남원읍 공천포로 137-5,제주특별자치도 서귀포시 남원읍 신례리 8-2,제주특별자치도 서귀포시 남원읍 신례리 8-2,36364474
1707,올레길 5코스(남원-쇠소깍 올레),,제주특별자치도 서귀포시 남원읍 남원리 91-6,제주특별자치도 서귀포시 남원읍 남원리 91-6,1009059068
1708,올레 5 게스트하우스,제주특별자치도 서귀포시 남원읍 공천포로 137-5,제주특별자치도 서귀포시 남원읍 신례리 8 대,제주특별자치도 서귀포시 남원읍 신례리 8 대,no
1709,마라도,제주특별자치도 서귀포시 대정읍 마라로101번길 46,제주특별자치도 서귀포시 대정읍 가파리 600,제주특별자치도 서귀포시 대정읍 가파리 600,11491877
1710,태광 식당,제주특별자치도 제주시 탑동로 142,제주특별자치도 제주시 용담일동 118,제주특별자치도 제주시 용담일동 118,11858960
1711,커피가게 쉬고 가게,제주특별자치도 서귀포시 표선면 민속해안로 593,제주특별자치도 서귀포시 표선면 표선리 40-71,제주특별자치도 서귀포시 표선면 표선리 40-71,30925801
1712,스타벅스 서귀포 DT점,제주특별자치도 서귀포시 일주서로 11,제주특별자치도 서귀포시 강정동 231-6,제주특별자치도 서귀포시 강정동 231-6,no
1713,해 민원 횟집,제주특별자치도 서귀포시 표선면 민속해안로 578-2,제주특별자치도 서귀포시 표선면 표선리 40-55,제주특별자치도 서귀포시 표선면 표선리 40-55,37073153
1714,시나,제주특별자치도 제주시 노형10길 3,제주특별자치도 제주시 노형동 3787-5,제주특별자치도 제주시 노형동 3787-5,1191453578
1715,내도음악상가,제주특별자치도 제주시 테우해안로 106,제주특별자치도 제주시 내도동 452-14,제주특별자치도 제주시 내도동 452-14,1200733900
1716,싹 게스트하우스,제주특별자치도 제주시 테우해안로 172,제주특별자치도 제주시 이호일동 1699-1,제주특별자치도 제주시 이호일동 1699-1,1518002515
1717,앤디앤라라홈뮤즈,제주특별자치도 제주시 애월읍 광상로 538,제주특별자치도 제주시 애월읍 소길리 1192,제주특별자치도 제주시 애월읍 소길리 1192,1598723826
1718,공순이네,제주특별자치도 제주시 애월읍 중산간서로 5642,제주특별자치도 제주시 애월읍 상가리 1980-2,제주특별자치도 제주시 애월읍 상가리 1980-2,37668766
1719,푼티노 스튜디오,제주특별자치도 제주시 애월읍 상가중길 9-4,제주특별자치도 제주시 애월읍 상가리 1189,제주특별자치도 제주시 애월읍 상가리 1189,1085418103
1720,솔트,제주특별자치도 제주시 애월읍 애월해안로 226,제주특별자치도 제주시 애월읍 고내리 1159,제주특별자치도 제주시 애월읍 고내리 1159,1135964801
1721,랑지다,제주특별자치도 제주시 애월읍 고내로7길 17,제주특별자치도 제주시 애월읍 고내리 983,제주특별자치도 제주시 애월읍 고내리 983,829174961
1722,유동룡 이타미 준 미술관,제주특별자치도 제주시 한림읍 용금로 906-10,제주특별자치도 제주시 한림읍 월림리 115-161,제주특별자치도 제주시 한림읍 월림리 115-161,1182253119
