,VISIT_AREA_NM,ROAD_NM_ADDR,LOTNO_ADDR,SEARCH_ADDR,data-id
0,제주 국제공항,제주특별자치도 제주시 공항로 2,제주특별자치도 제주시 용담2동 2002,제주특별자치도 제주시 용담2동 2002,11576965
1,제주 건입 현대아파트,제주특별자치도 제주시 만덕로3길 26,제주특별자치도 제주시 건입동 940-3,제주특별자치도 제주시 건입동 940-3,16987450
2,제주원 렌터카 본점,제주특별자치도 제주시 용해로 58-7,제주특별자치도 제주시 용담2동 920-6,제주특별자치도 제주시 용담2동 920-6,31919483
3,피즈,제주특별자치도 제주시 애월읍 애월로 29,제주특별자치도 제주시 애월읍 애월리 2481-3,제주특별자치도 제주시 애월읍 애월리 2481-3,1648347549
4,명월 국민학교,제주특별자치도 제주시 한림읍 명월로 48,제주특별자치도 제주시 한림읍 명월리 1734,제주특별자치도 제주시 한림읍 명월리 1734,1383910337
5,연리지 가든,제주특별자치도 제주시 한경면 두조로 190-20,제주특별자치도 제주시 한경면 두모리 288,제주특별자치도 제주시 한경면 두모리 288,1375427531
6,아르떼 뮤지엄 제주,제주특별자치도 제주시 애월읍 어림비로 478,제주특별자치도 제주시 애월읍 어음리 1503,제주특별자치도 제주시 애월읍 어음리 1503,1669734880
7,천지연폭포,,제주특별자치도 서귀포시 서홍동 2565,제주특별자치도 서귀포시 서홍동 2565,no
8,이스턴 호텔 제주,제주특별자치도 서귀포시 서호중로 65,제주특별자치도 서귀포시 서호동 1522-2,제주특별자치도 서귀포시 서호동 1522-2,1744448811
9,둘레길 중문 본점,제주특별자치도 서귀포시 천제연로 209-1,제주특별자치도 서귀포시 중문동 2006-3,제주특별자치도 서귀포시 중문동 2006-3,1201933332
10,천제연폭포,제주특별자치도 서귀포시 천제연로 132,제주특별자치도 서귀포시 중문동 2232,제주특별자치도 서귀포시 중문동 2232,11491637
11,무로이,제주특별자치도 서귀포시 안덕면 동광본동로 21,제주특별자치도 서귀포시 안덕면 동광리 962,제주특별자치도 서귀포시 안덕면 동광리 962,1519617703
12,까사디니아,제주특별자치도 서귀포시 안덕면 대평로 42,제주특별자치도 서귀포시 안덕면 창천리 901-1,제주특별자치도 서귀포시 안덕면 창천리 901-1,1231669980
13,돈블럭,제주특별자치도 서귀포시 천제연로 303,제주특별자치도 서귀포시 회수동 980,제주특별자치도 서귀포시 회수동 980,1240633847
14,빽다방 호텔 더본 제주점,제주특별자치도 서귀포시 색달로 18,제주특별자치도 서귀포시 색달동 2138,제주특별자치도 서귀포시 색달동 2138,1727743072
15,어멍 국수,제주특별자치도 서귀포시 안덕면 화순로 101,제주특별자치도 서귀포시 안덕면 화순리 337-9,제주특별자치도 서귀포시 안덕면 화순리 337-9,1206944963
16,제주동문시장,제주특별자치도 제주시 동문로 16,제주특별자치도 제주시 일도일동 1148-2,제주특별자치도 제주시 일도일동 1148-2,13347076
17,바이 제주,제주특별자치도 제주시 서해안로 626,제주특별자치도 제주시 용담삼동 1023-2,제주특별자치도 제주시 용담삼동 1023-2,1389108105
18,팜파스 호텔 제주,제주특별자치도 제주시 서해안로 368-3,제주특별자치도 제주시 용담삼동 2555,제주특별자치도 제주시 용담삼동 2555,1790880267
19,고 고리 식당,제주특별자치도 제주시 인다5길 11-10,제주특별자치도 제주시 아라일동 6113-5,제주특별자치도 제주시 아라일동 6113-5,479567079
20,함덕해수욕장,제주특별자치도 제주시 조천읍 조함해안로 525,제주특별자치도 제주시 조천읍 함덕리 1004-10,제주특별자치도 제주시 조천읍 함덕리 1004-10,no
21,별방진,,제주특별자치도 제주시 구좌읍 하도리 3354,제주특별자치도 제주시 구좌읍 하도리 3354,20059158
22,성산일출봉 농협 하나로마트,제주특별자치도 서귀포시 성산읍 일주동로 4282,제주특별자치도 서귀포시 성산읍 고성리 1106-3,제주특별자치도 서귀포시 성산읍 고성리 1106-3,13373692
23,제주다 모르,제주특별자치도 서귀포시 성산읍 오조로 149-33,제주특별자치도 서귀포시 성산읍 오조리 596,제주특별자치도 서귀포시 성산읍 오조리 596,1405555125
24,성산포항,,제주특별자치도 서귀포시 성산읍 성산리,제주특별자치도 서귀포시 성산읍 성산리,11491438
25,우도,,제주특별자치도 제주시 우도면 연평리,제주특별자치도 제주시 우도면 연평리,11891284
26,로뎀 가든,제주특별자치도 제주시 우도면 우도해안길 264,제주특별자치도 제주시 우도면 연평리 2515,제주특별자치도 제주시 우도면 연평리 2515,31462263
27,드르쿰다in성산,제주특별자치도 서귀포시 성산읍 섭지코지로25번길 64,제주특별자치도 서귀포시 성산읍 고성리 372-1,제주특별자치도 서귀포시 성산읍 고성리 372-1,1340404586
28,올레리조트,제주특별자치도 제주시 애월읍 부룡수길 33,제주특별자치도 제주시 애월읍 신엄리 2867-3,제주특별자치도 제주시 애월읍 신엄리 2867-3,1709604195
29,빌리가,제주특별자치도 제주시 덕지2길 6,제주특별자치도 제주시 이호일동 1903-1,제주특별자치도 제주시 이호일동 1903-1,no
30,애월 찜,제주특별자치도 제주시 애월읍 애월해안로 454-5,제주특별자치도 제주시 애월읍 신엄리 2807-6,제주특별자치도 제주시 애월읍 신엄리 2807-6,36060798
31,스타벅스 제주 애월 DT점,제주특별자치도 제주시 애월읍 애월해안로 376,제주특별자치도 제주시 애월읍 고내리 340,제주특별자치도 제주시 애월읍 고내리 340,86596503
32,GS25 애월 신엄 해안점,제주특별자치도 제주시 애월읍 애월해안로 466,제주특별자치도 제주시 애월읍 신엄리 2802-6,제주특별자치도 제주시 애월읍 신엄리 2802-6,1949123130
33,단소,제주특별자치도 제주시 애월읍 애월로 139-4,제주특별자치도 제주시 애월읍 애월리 1747-1,제주특별자치도 제주시 애월읍 애월리 1747-1,1317146125
34,판포 포구,,제주특별자치도 제주시 한경면 판포리,제주특별자치도 제주시 한경면 판포리,1012327599
35,선운 정사,제주특별자치도 제주시 애월읍 구몰동길 65,제주특별자치도 제주시 애월읍 봉성리 3608,제주특별자치도 제주시 애월읍 봉성리 3608,13337894
36,돝밭,제주특별자치도 제주시 애월읍 애월해안로 249,제주특별자치도 제주시 애월읍 고내리 1109-1,제주특별자치도 제주시 애월읍 고내리 1109-1,1598819482
37,제주 할망 밥상 애월점,제주특별자치도 제주시 애월읍 하귀9길 8,제주특별자치도 제주시 애월읍 하귀1리 118-3,제주특별자치도 제주시 애월읍 하귀1리 118-3,1269288996
38,메가 MGC 커피 제주일주서로점,제주특별자치도 제주시 일주서로 7281,제주특별자치도 제주시 외도이동 1939,제주특별자치도 제주시 외도이동 1939,1259216430
39,대원암,제주특별자치도 제주시 월대5길 17,제주특별자치도 제주시 외도이동 304-1,제주특별자치도 제주시 외도이동 304-1,no
40,이호테우해수욕장,,제주특별자치도 제주시 이호일동 1665-13,제주특별자치도 제주시 이호일동 1665-13,no
41,제주 국제공항 국내선 출발 3번 게이트,제주특별자치도 제주시 공항로 2,제주특별자치도 제주시 용담2동 2002,제주특별자치도 제주시 용담2동 2002,33253697
42,하이 렌터카 제주본점,제주특별자치도 제주시 용해로 58-7,제주특별자치도 제주시 용담이동 920-6,제주특별자치도 제주시 용담이동 920-6,31919483
43,한림 칼국수 공항점,제주특별자치도 제주시 광평중길 82,제주특별자치도 제주시 노형동 3153-1,제주특별자치도 제주시 노형동 3153-1,1564788563
44,물영아리,,제주특별자치도 서귀포시 남원읍 수망리 산 188,제주특별자치도 서귀포시 남원읍 수망리 산 188,17071747
45,서귀포 매일 올레시장,제주특별자치도 서귀포시 중앙로62번길 18,제주특별자치도 서귀포시 서귀동 277-1,제주특별자치도 서귀포시 서귀동 277-1,17043242
46,엉또폭포,,제주특별자치도 서귀포시 강정동 5628,제주특별자치도 서귀포시 강정동 5628,no
47,올레 농수산,제주특별자치도 서귀포시 대정읍 하모항구로 22-15,제주특별자치도 서귀포시 대정읍 하모리 770-30,제주특별자치도 서귀포시 대정읍 하모리 770-30,no
48,슬랩,제주특별자치도 제주시 한림읍 한림로 354,제주특별자치도 제주시 한림읍 협재리 1740-2,제주특별자치도 제주시 한림읍 협재리 1740-2,1718061600
49,김씨술생활 제주협재점,제주특별자치도 제주시 한림읍 한림로 406,제주특별자치도 제주시 한림읍 협재리 1586,제주특별자치도 제주시 한림읍 협재리 1586,1619292194
50,씨스테이호텔&스파,제주특별자치도 제주시 애월읍 애월해안로 255,제주특별자치도 제주시 애월읍 고내리 1105-1,제주특별자치도 제주시 애월읍 고내리 1105-1,37101956
51,한라산국립공원 관음사 탐방로,,제주특별자치도 제주시 오라이동 산 107-20,제주특별자치도 제주시 오라이동 산 107-20,16998220
52,산방산 탄산온천,제주특별자치도 서귀포시 안덕면 사계북로41번길 192,제주특별자치도 서귀포시 안덕면 사계리 981,제주특별자치도 서귀포시 안덕면 사계리 981,13044022
53,금능해수욕장,제주특별자치도 제주시 한림읍 금능길 119-10,제주특별자치도 제주시 한림읍 금능리 2026,제주특별자치도 제주시 한림읍 금능리 2026,1101126590
54,수풀,제주특별자치도 제주시 한림읍 명랑로 8,제주특별자치도 제주시 한림읍 한림리 1066,제주특별자치도 제주시 한림읍 한림리 1066,no
55,9.81파크,제주특별자치도 제주시 애월읍 천덕로 880-24,제주특별자치도 제주시 애월읍 어음리 산 131-3,제주특별자치도 제주시 애월읍 어음리 산 131-3,no
56,바닷속 고등어 쌈밥,제주특별자치도 제주시 애월읍 일주서로 7089,제주특별자치도 제주시 애월읍 하귀1리 1548,제주특별자치도 제주시 애월읍 하귀1리 1548,33044524
57,은희네 해장국 외도점,제주특별자치도 제주시 우정로15길 42-8,제주특별자치도 제주시 외도일동 532-8,제주특별자치도 제주시 외도일동 532-8,38667606
58,롯데시티 호텔 제주,제주특별자치도 제주시 도령로 83,제주특별자치도 제주시 연동 2324-6,제주특별자치도 제주시 연동 2324-6,33704736
59,명호 마농 갈비 본점,제주특별자치도 제주시 신대로12길 15,제주특별자치도 제주시 연동 292-57,제주특별자치도 제주시 연동 292-57,1835331356
60,미친 부엌,제주특별자치도 제주시 탑동로 15,제주특별자치도 제주시 삼도2동 1192-28,제주특별자치도 제주시 삼도2동 1192-28,36772248
61,무용담,제주특별자치도 제주시 흥운길 91,제주특별자치도 제주시 용담이동 448,제주특별자치도 제주시 용담이동 448,1214313926
62,재벌 식당,제주특별자치도 제주시 도령로7길 20,제주특별자치도 제주시 연동 1965-4,제주특별자치도 제주시 연동 1965-4,no
63,디 앤디 파트 먼트 제주,제주특별자치도 제주시 탑동로2길 3,제주특별자치도 제주시 삼도이동 1261-6,제주특별자치도 제주시 삼도이동 1261-6,1322078819
64,산방식당 화북점,제주특별자치도 제주시 선반로 67,제주특별자치도 제주시 화북일동 2229,제주특별자치도 제주시 화북일동 2229,1754603487
65,제주 국제공항 렌터카 하우스,제주특별자치도 제주시 공항로 2,제주특별자치도 제주시 용담2동 1984-8,제주특별자치도 제주시 용담2동 1984-8,no
66,퍼스트 렌터카,제주특별자치도 제주시 다호북길 111,제주특별자치도 제주시 도두이동 414-5,제주특별자치도 제주시 도두이동 414-5,37404444
67,함덕 돌핀 레저 본사,제주특별자치도 제주시 조천읍 조함해안로 538,제주특별자치도 제주시 조천읍 함덕리 산 14-58,제주특별자치도 제주시 조천읍 함덕리 산 14-58,13023900
68,밀라네 사,제주특별자치도 제주시 매촌2길 78,제주특별자치도 제주시 도련일동 1751-7,제주특별자치도 제주시 도련일동 1751-7,1004399342
69,일송 회수산,제주특별자치도 서귀포시 남원읍 위미중앙로196번길 13,제주특별자치도 서귀포시 남원읍 위미리 1760-3,제주특별자치도 서귀포시 남원읍 위미리 1760-3,13286289
70,신신 호텔 천지연,제주특별자치도 서귀포시 서문로 42-1,제주특별자치도 서귀포시 서귀동 325-1,제주특별자치도 서귀포시 서귀동 325-1,1200000744
71,올레 야시장,제주특별자치도 서귀포시 중정로61번길 20,제주특별자치도 서귀포시 서귀동 276-19,제주특별자치도 서귀포시 서귀동 276-19,1650279666
72,소원 식당,제주특별자치도 제주시 일주동로 348,제주특별자치도 제주시 삼양이동 2174-8,제주특별자치도 제주시 삼양이동 2174-8,33856064
73,쇠소깍,제주특별자치도 서귀포시 쇠소깍로 104,제주특별자치도 서귀포시 하효동 990-1,제주특별자치도 서귀포시 하효동 990-1,11707633
74,쇠소깍 빵 명장,제주특별자치도 서귀포시 쇠소깍로 122,제주특별자치도 서귀포시 하효동 994-2,제주특별자치도 서귀포시 하효동 994-2,1238493751
75,스쿠버 스토리 게스트하우스,제주특별자치도 서귀포시 태평로536번길 17,제주특별자치도 서귀포시 동홍동 192-39,제주특별자치도 서귀포시 동홍동 192-39,32625545
76,몸냥공작소,제주특별자치도 제주시 애월읍 하소로 594,제주특별자치도 제주시 애월읍 유수암리 2475-1,제주특별자치도 제주시 애월읍 유수암리 2475-1,1619676496
77,제주키즈독채펜션아이랑,제주특별자치도 제주시 애월읍 고내로7길 34,제주특별자치도 제주시 애월읍 고내리 1071-1,제주특별자치도 제주시 애월읍 고내리 1071-1,36351061
78,더 마당,제주특별자치도 제주시 애월읍 애월해안로 232-1,제주특별자치도 제주시 애월읍 고내리 1157,제주특별자치도 제주시 애월읍 고내리 1157,1443850431
79,왕서방,제주특별자치도 제주시 애월읍 중엄3길 2-1,제주특별자치도 제주시 애월읍 신엄리 757-2,제주특별자치도 제주시 애월읍 신엄리 757-2,1313072100
80,소랑 아시,제주특별자치도 서귀포시 중문관광로 27,제주특별자치도 서귀포시 색달동 2507-1,제주특별자치도 서귀포시 색달동 2507-1,1745318490
81,제주 오성 식당,제주특별자치도 서귀포시 중문관광로 27,제주특별자치도 서귀포시 색달동 2507-1,제주특별자치도 서귀포시 색달동 2507-1,1348682995
82,테디베어 하우스 테지움 제주점,제주특별자치도 제주시 애월읍 평화로 2159,제주특별자치도 제주시 애월읍 소길리 155-106,제주특별자치도 제주시 애월읍 소길리 155-106,19555652
83,투썸플레이스 제주 애월 하귀점,제주특별자치도 제주시 애월읍 일주서로 7209,제주특별자치도 제주시 애월읍 하귀1리 275,제주특별자치도 제주시 애월읍 하귀1리 275,1549505130
84,제주 팔팔 국밥,제주특별자치도 제주시 용담로 68,제주특별자치도 제주시 용담이동 599-8,제주특별자치도 제주시 용담이동 599-8,1369179092
85,신제 줄참 닭갈비 신에주점,제주특별자치도 제주시 신광로4길 1,제주특별자치도 제주시 연동 261-14,제주특별자치도 제주시 연동 261-14,16837174
86,트레비 호텔,제주특별자치도 제주시 연동7길 8,제주특별자치도 제주시 연동 272-50,제주특별자치도 제주시 연동 272-50,11482201
87,국제 리더스클럽,제주특별자치도 제주시 조천읍 조함해안로 321-21,제주특별자치도 제주시 조천읍 신흥리 1-11,제주특별자치도 제주시 조천읍 신흥리 1-11,1762553804
88,델문도,제주특별자치도 제주시 조천읍 조함해안로 519-10,제주특별자치도 제주시 조천읍 함덕리 1008-1,제주특별자치도 제주시 조천읍 함덕리 1008-1,36859834
89,삼촌네 칼국수,제주특별자치도 서귀포시 안덕면 중산간서로 1815,제주특별자치도 서귀포시 안덕면 서광리 279,제주특별자치도 서귀포시 안덕면 서광리 279,1943564145
90,신화 테마파크,제주특별자치도 서귀포시 안덕면 신화역사로304번길 98,제주특별자치도 서귀포시 안덕면 서광리 산 35-20,제주특별자치도 서귀포시 안덕면 서광리 산 35-20,no
91,제주신화 월드 한라원,제주특별자치도 서귀포시 안덕면 신화역사로304번길 38,제주특별자치도 서귀포시 안덕면 서광리 산 24,제주특별자치도 서귀포시 안덕면 서광리 산 24,1533978056
92,제주신화 월드 신화관,제주특별자치도 서귀포시 안덕면 신화역사로304번길 38,제주특별자치도 서귀포시 안덕면 서광리 산 24,제주특별자치도 서귀포시 안덕면 서광리 산 24,1101198197
93,신화 워터파크,제주특별자치도 서귀포시 안덕면 신화역사로304번길 38,제주특별자치도 서귀포시 안덕면 서광리 산 24,제주특별자치도 서귀포시 안덕면 서광리 산 24,1960638614
94,제주신화 월드 푸드 애비뉴,제주특별자치도 서귀포시 안덕면 신화역사로304번길 38,제주특별자치도 서귀포시 안덕면 서광리 산 24,제주특별자치도 서귀포시 안덕면 서광리 산 24,1230971229
95,아이 조팝 게임장,제주특별자치도 서귀포시 안덕면 신화역사로304번길 98,제주특별자치도 서귀포시 안덕면 서광리 산 24-11,제주특별자치도 서귀포시 안덕면 서광리 산 24-11,1620871880
96,제주항공 우주 박물관,제주특별자치도 서귀포시 안덕면 녹차분재로 218,제주특별자치도 서귀포시 안덕면 서광리 산 39,제주특별자치도 서귀포시 안덕면 서광리 산 39,33306659
97,오설록 티 뮤지엄,제주특별자치도 서귀포시 안덕면 신화역사로 15,제주특별자치도 서귀포시 안덕면 서광리 1235-1,제주특별자치도 서귀포시 안덕면 서광리 1235-1,11612628
98,한화리조트 제주,제주특별자치도 제주시 명림로 575-107,제주특별자치도 제주시 회천동 3-16,제주특별자치도 제주시 회천동 3-16,11613289
99,바운스 슈퍼 파크 제주센터,제주특별자치도 제주시 연사6길 61,제주특별자치도 제주시 오라이동 1758,제주특별자치도 제주시 오라이동 1758,1734913317
100,가다 오다,제주특별자치도 제주시 신산로 13,제주특별자치도 제주시 일도이동 1025-4,제주특별자치도 제주시 일도이동 1025-4,no
101,비자림 국숫집,제주특별자치도 제주시 구좌읍 비자숲길 46,제주특별자치도 제주시 구좌읍 평대리 3163-3,제주특별자치도 제주시 구좌읍 평대리 3163-3,1173398209
102,비자림,제주특별자치도 제주시 구좌읍 비자숲길 55,제주특별자치도 제주시 구좌읍 평대리 3161-1,제주특별자치도 제주시 구좌읍 평대리 3161-1,12370507
103,목장카페드르쿰다,제주특별자치도 서귀포시 표선면 번영로 2454,제주특별자치도 서귀포시 표선면 성읍리 2873,제주특별자치도 서귀포시 표선면 성읍리 2873,13126047
104,검은 여식 당,제주특별자치도 서귀포시 표선면 번영로 3496,제주특별자치도 서귀포시 표선면 표선리 1861,제주특별자치도 서귀포시 표선면 표선리 1861,32166269
105,신비의 도로,,제주특별자치도 제주시 노형동 291-16,제주특별자치도 제주시 노형동 291-16,no
106,돈향기,제주특별자치도 제주시 관덕로15길 30,제주특별자치도 제주시 건입동 1384,제주특별자치도 제주시 건입동 1384,16742074
107,하이 버니,제주특별자치도 제주시 아연로 232,제주특별자치도 제주시 오라이동 94-1,제주특별자치도 제주시 오라이동 94-1,1261964060
108,제주동문재래시장 공영주차장,제주특별자치도 제주시 중앙로13길 16-8,제주특별자치도 제주시 이도일동 1330-5,제주특별자치도 제주시 이도일동 1330-5,1033018979
109,한라봉 스시,제주특별자치도 제주시 애월읍 애월북서길 54,제주특별자치도 제주시 애월읍 애월리 2550,제주특별자치도 제주시 애월읍 애월리 2550,1822018812
110,제주 김만복 본점,제주특별자치도 제주시 오라로 41,제주특별자치도 제주시 오라삼동 2250-1,제주특별자치도 제주시 오라삼동 2250-1,1773970782
111,제주공항 렌터카 본사,제주특별자치도 제주시 다호5길 17,제주특별자치도 제주시 도두이동 390-6,제주특별자치도 제주시 도두이동 390-6,13449577
112,힐스테이트 제주,제주특별자치도 제주시 연동6길 5,제주특별자치도 제주시 연동 263-2,제주특별자치도 제주시 연동 263-2,1865116259
113,돌담 흑돼지 연동,제주특별자치도 제주시 연동7길 35,제주특별자치도 제주시 연동 273-35,제주특별자치도 제주시 연동 273-35,1766357276
114,우진 해장국,제주특별자치도 제주시 서사로 11,제주특별자치도 제주시 삼도이동 831,제주특별자치도 제주시 삼도이동 831,13418405
115,런던 베이글 뮤지엄 제주점,제주특별자치도 제주시 구좌읍 동복로 85,제주특별자치도 제주시 구좌읍 동복리 719-1,제주특별자치도 제주시 구좌읍 동복리 719-1,1422544447
116,물방울 포토존,고내리 435,,고내리 435,no
117,독개 물항,제주특별자치도 제주시 한림읍 한림로 478,제주특별자치도 제주시 한림읍 옹포리 593-1,제주특별자치도 제주시 한림읍 옹포리 593-1,17021628
118,협재해수욕장,제주특별자치도 제주시 한림읍 한림로 329-10,제주특별자치도 제주시 한림읍 협재리 2447,제주특별자치도 제주시 한림읍 협재리 2447,no
119,마거릿 펜션,제주특별자치도 서귀포시 예래로68번길 11-16,제주특별자치도 서귀포시 상예동 506,제주특별자치도 서귀포시 상예동 506,38562015
120,발 편한 세상,제주특별자치도 서귀포시 천제연로 113,제주특별자치도 서귀포시 색달동 2481,제주특별자치도 서귀포시 색달동 2481,no
121,자연스러운 식당,제주특별자치도 서귀포시 태평로92번길 8,제주특별자치도 서귀포시 호근동 1559-2,제주특별자치도 서귀포시 호근동 1559-2,1041364852
122,황이지 선녀탕,,제주특별자치도 서귀포시 서홍동,제주특별자치도 서귀포시 서홍동,1986792057
123,표선해수욕장,,제주특별자치도 서귀포시 표선면 표선리,제주특별자치도 서귀포시 표선면 표선리,1460989444
124,해비치 호텔&리조트 제주,제주특별자치도 서귀포시 표선면 민속해안로 537,제주특별자치도 서귀포시 표선면 표선리 40-69,제주특별자치도 서귀포시 표선면 표선리 40-69,10970369
125,산굼부리,,제주특별자치도 제주시 조천읍 교래리 166-2,제주특별자치도 제주시 조천읍 교래리 166-2,no
126,고국 수,제주특별자치도 제주시 용문로14길 4,제주특별자치도 제주시 용담이동 2682-7,제주특별자치도 제주시 용담이동 2682-7,1041325506
127,수수인 박,제주특별자치도 서귀포시 색달로81번길 61,제주특별자치도 서귀포시 색달동 2036,제주특별자치도 서귀포시 색달동 2036,no
128,지정식당,제주특별자치도 제주시 성화로 30,제주특별자치도 제주시 용담이동 930-25 대,제주특별자치도 제주시 용담이동 930-25 대,16750598
129,시간당 킬로미터,제주특별자치도 서귀포시 신동로67번길 11,제주특별자치도 서귀포시 서호동 1459-5,제주특별자치도 서귀포시 서호동 1459-5,1710259996
130,연동,제주특별자치도 서귀포시 일주서로 968-10,제주특별자치도 서귀포시 색달동 2156-2,제주특별자치도 서귀포시 색달동 2156-2,no
131,다이소 서귀포 중문점,제주특별자치도 서귀포시 일주서로 996,제주특별자치도 서귀포시 색달동 2081-1,제주특별자치도 서귀포시 색달동 2081-1,1081130475
132,마라도가 파도 정기여객선 대합실,제주특별자치도 서귀포시 대정읍 최남단해안로 120,제주특별자치도 서귀포시 대정읍 하모리 646-20,제주특별자치도 서귀포시 대정읍 하모리 646-20,1325578771
133,가파도,,제주특별자치도 서귀포시 대정읍 가파리 276,제주특별자치도 서귀포시 대정읍 가파리 276,no
134,블랑 로쉐,제주특별자치도 서귀포시 대정읍 가파로 239,제주특별자치도 서귀포시 대정읍 가파리 197,제주특별자치도 서귀포시 대정읍 가파리 197,1030981622
